id,label,title,url,hub,authority,pagerank,in_degree,out_degree,closeness,betweenness
39188279,39188279,The Best Books I Read In 2017,https://taylorpearson.me/best-books-2017/,0.007624312277752492,0.0,0.0011363636363636365,0.0,0.1297709923664122,0.0,0.0
581639360,581639360,Blockchain Supply Chain Use Cases: A Multi-Trillion Dollar Opportunity?,https://taylorpearson.me/blockchain-supply-chain-use-cases/,0.0076320608197942156,0.0,0.0011363636363636365,0.0,0.12213740458015267,0.0,0.0
3282443104,3282443104,The Best Longform Articles I Read In 2017,https://taylorpearson.me/longform-2017/,0.0076320608197942156,0.0,0.0011363636363636365,0.0,0.12213740458015267,0.0,0.0
2894657301,2894657301,12 Books That Make You Think,https://taylorpearson.me/books-that-make-you-think/,0.007628348130072441,0.0,0.0011363636363636365,0.0,0.12213740458015267,0.0,0.0
2658293213,2658293213,Why Apprenticeships Matter,https://taylorpearson.me/apprenticeships-matter/,0.007620333649831474,0.0,0.0011363636363636365,0.0,0.12213740458015267,0.0,0.0
4029244356,4029244356,Why the ‘Worst’ Crypto Networks Will be the Biggest,https://taylorpearson.me/why-the-worst-crypto-networks-will-be-the-biggest/,0.0076320608197942156,0.0,0.0011363636363636365,0.0,0.12213740458015267,0.0,0.0
2979100984,2979100984,What Gives Bitcoin Value? Or The Most Important Idea In Cryptocurrency,https://taylorpearson.me/what-gives-bitcoin-value/,0.007604641014061696,0.0009272809971220825,0.00125,0.015267175572519083,0.11450381679389313,0.015267175572519083,0.0
3232810038,3232810038,Blockchain Explained: How Does Blockchain Technology Work?,https://taylorpearson.me/blockchain-explained/,0.007635822761534331,0.0,0.0011363636363636365,0.0,0.13740458015267176,0.0,0.0
973153657,973153657,How to Stop Procrastinating Using the 70% Rule,https://taylorpearson.me/how-to-stop-procrastinating/,0.007604641014061696,0.0009510903557598315,0.0012165381620475484,0.015267175572519083,0.11450381679389313,0.2553606237816764,0.0
1214254885,1214254885,The Ultimate Guide to Apprenticeships (Or How To Find Your First Remote Job),https://taylorpearson.me/entry-level-remote-jobs/,0.007612578638389485,0.0,0.0011363636363636365,0.0,0.12213740458015267,0.0,0.0
863200122,863200122,State of Bitcoin (Fall 2018),https://taylorpearson.me/state-of-bitcoin-2018/,0.007604641014061696,0.0,0.0011363636363636365,0.0,0.11450381679389313,0.0,0.0
2065148991,2065148991,About Taylor,https://taylorpearson.me/about/,0.007723151225722564,0.0004624507560431319,0.0012825199886985499,0.007633587786259542,0.16030534351145037,0.33589743589743587,0.1857995693873556
3000647749,3000647749,The Business Production Function: A Framework for Growing Early Stage Ventures,https://taylorpearson.me/business-strategy-framework/,0.007932774023283505,0.0009433670527418135,0.0012302730192129657,0.015267175572519083,0.282442748091603,0.2543689320388349,0.10789489136817369
1252230089,1252230089,What is a Security Token? A Comprehensive Guide to How They Work and Their Impact,https://taylorpearson.me/what-is-a-security-token/,0.007616337934236324,0.0,0.0011363636363636365,0.0,0.12213740458015267,0.0,0.0
3014146540,3014146540,Will Smart Contracts Eat the World?,https://taylorpearson.me/smart-contract-applications/,0.0076398547817736724,0.0,0.0011363636363636365,0.0,0.1297709923664122,0.0,0.0
611912809,611912809,How to Unlock Your Creative Potential,https://taylorpearson.me/unlock-creative-potential/,0.007652027106116523,0.0004819124227956069,0.0011646248266290492,0.007633587786259542,0.1297709923664122,0.20404984423676012,0.0
2492286775,2492286775,The Best Intermediate-ish Crypto Resources,https://taylorpearson.me/intermediate-crypto-resources/,0.007620276928552472,0.0,0.0011363636363636365,0.0,0.12213740458015267,0.0,0.0
152682107,152682107,The 3 Laws of Marketing: Why Nobody Buys Your Sh*t,https://taylorpearson.me/3-laws/,0.0076559329093057365,0.0,0.0011363636363636365,0.0,0.12213740458015267,0.0,0.0
3515250179,3515250179,The Paint Drop Method for Figuring Out What To Do with Your Life (and Becoming the Best in the World At It),https://taylorpearson.me/what-should-i-do-with-my-life/,0.00775812253091735,0.0,0.0011363636363636365,0.0,0.16030534351145037,0.0,0.0
392005444,392005444,A Blockchain Explanation Your Parents Could Understand,https://taylorpearson.me/blockchain-for-dummies/,0.007624143940799276,0.0,0.0011363636363636365,0.0,0.1297709923664122,0.0,0.0
1440306623,1440306623,Priority Management: How to Prioritize Tasks and Keep Your Life in Balance,https://taylorpearson.me/how-to-prioritize/,0.007805640513625057,0.0,0.0011363636363636365,0.0,0.17557251908396945,0.0,0.0
4144816274,4144816274,Press Mentions,https://taylorpearson.me/press/,0.007604641014061696,0.0,0.0011363636363636365,0.0,0.11450381679389313,0.0,0.0
